{
  "format": "kronland-pack",
  "version": 1,
  "id": "k7m2q9",
  "title": {
    "de": "Mein erstes Level",
    "en": "My first level"
  },
  "summary": {
    "de": "",
    "en": ""
  },
  "levels": [
    {
      "id": "r1-4",
      "scenario": {
        "format": "kronland-scenario",
        "version": 2,
        "id": "r1-4",
        "kind": "adventure",
        "end": "script",
        "order": 14,
        "title": {
          "de": "Im Schneetreiben",
          "en": "In the Blizzard"
        },
        "summary": {
          "de": "Schleifen mit Bedingung: Wie weit ist es bis zum Waldrand? Ein Zettel der Magd, ein Taler im Schnee und eine Spur durch alle Kurven.",
          "en": "Loops with a condition: how far is it to the edge of the forest? A note from the maid, a coin in the snow and a track through every bend."
        },
        "briefing": {
          "de": "Schneetreiben. Niemand weiß, wie weit es bis zum Waldrand ist – „while nelia.can_step():“ läuft, solange vorn frei ist. Ausführen beginnt die Etappe jedes Mal von vorn: erst überlegen, dann ausführen. Taler und Spur gibt es in drei Welten – „Prüfen“ zeigt, ob dein Programm in allen klappt.",
          "en": "Blizzard. Nobody knows how far it is to the edge of the forest – “while nelia.can_step():” runs as long as the way ahead is free. Run starts the stage over every time: think first, then run. Coin and track come in three worlds – “Check” shows whether your program works in all of them."
        },
        "victoryText": {
          "de": "Die Geflohenen sind gefunden – gemeinsam geht es weiter nach Lindgrund.",
          "en": "The runaways are found – together they go on to Lindgrund."
        },
        "learn": {
          "de": [
            "while-Schleife mit Bedingung",
            "Zählen in der Schleife",
            "Vorhersagen",
            "Sensoren in der Bedingung"
          ],
          "en": [
            "while loop with a condition",
            "counting in the loop",
            "predicting",
            "sensors in the condition"
          ]
        },
        "worlds": [
          {
            "id": "normal",
            "title": {
              "de": "Normalfall",
              "en": "Normal case"
            }
          },
          {
            "id": "near",
            "title": {
              "de": "Alles ganz nah",
              "en": "Everything close"
            }
          },
          {
            "id": "far",
            "title": {
              "de": "Alles weit weg",
              "en": "Everything far away"
            }
          }
        ],
        "world": {
          "base": "flat",
          "width": 20,
          "height": 28,
          "fog": false,
          "starts": [
            {
              "x": 2,
              "y": 3
            }
          ],
          "tracks": {
            "mode": "permanent"
          },
          "places": {
            "a_start": {
              "x": 2,
              "y": 3,
              "r": 0
            },
            "a_view": {
              "x": 9,
              "y": 4,
              "r": 4
            },
            "b_start": {
              "x": 2,
              "y": 13,
              "r": 0
            },
            "b_view": {
              "x": 9,
              "y": 14,
              "r": 4
            },
            "c_start": {
              "x": 2,
              "y": 23,
              "r": 0
            },
            "c_view": {
              "x": 9,
              "y": 24,
              "r": 4
            }
          }
        },
        "weatherCycle": [
          [
            "winter",
            3600000
          ]
        ],
        "players": [
          {
            "kind": "human",
            "hero": "nelia",
            "hq": false
          }
        ],
        "sections": [
          {
            "id": "world",
            "title": {
              "de": "Welt aufbauen",
              "en": "Build the world"
            },
            "level": "mission",
            "visibility": "collapsed",
            "editable": false,
            "file": "world.py",
            "code": "# Drei Abschnitte einer Karte, getrennt durch Felsbänder (Reihen 8–9 und 18–19).\n# Drei Welten (scenario.json \"worlds\"): world.id sagt, welche gebaut wird – der Normalfall und zwei Randfälle.\nfor x in range(world.width):\n    for y in (8, 9, 18, 19):\n        world.set_height(x, y, world.height_at(x, y) + 2400)\n        world.set_cliff(x, y)\n\n# Wo der Wald beginnt (Abschnitt 1) und wo der Taler liegt (Abschnitt 2), je Welt\nFOREST = {\"normal\": 12, \"near\": 3, \"far\": 17}[world.id]\nCOIN = {\"normal\": 9, \"near\": 2, \"far\": 14}[world.id]\n\n# Abschnitt 1: der Waldrand im Osten – in der Welt „Alles ganz nah“ steht er direkt vor Nelia\nfor y in range(0, 8):\n    for x in range(FOREST, FOREST + 3):\n        add_tree(x, y)\nfor x, y in [(17, 1), (18, 4), (16, 6), (1, 0), (5, 7)]:\n    if x < FOREST or x >= FOREST + 3:\n        add_tree(x, y)\n\n# Abschnitt 2: ein Taler im Schnee, dahinter wieder Wald – „ganz nah“ liegt er unter Nelia, „weit weg“ kurz vor dem Wald\nadd_item(\"coin\", COIN, 13)\nfor y in range(10, 18):\n    for x in range(15, 18):\n        add_tree(x, y)\nfor x, y in [(1, 10), (4, 17), (11, 16), (19, 12)]:\n    add_tree(x, y)\n\n# Abschnitt 3: die Spur der Geflohenen bis zu ihrer Hütte – in jeder Welt mit anderen Kurven und anderswo\nif world.id == \"near\":\n    HUT = (10, 25)\n    trail = [(x, 23) for x in range(3, 6)] + [(5, 24)] + [(x, 25) for x in range(5, 11)]\nelif world.id == \"far\":\n    HUT = (17, 24)\n    trail = [(3, 23), (4, 23), (4, 22)] + [(x, 21) for x in range(4, 9)] + [(8, y) for y in range(22, 27)]\n    trail += [(x, 26) for x in range(9, 13)] + [(12, 25), (12, 24)] + [(x, 23) for x in range(12, 16)]\n    trail += [(15, 24), (16, 24), (17, 24)]\nelse:\n    HUT = (16, 25)\n    trail = [(x, 23) for x in range(3, 8)] + [(7, 22), (7, 21)] + [(x, 21) for x in range(8, 12)]\n    trail += [(11, y) for y in range(22, 26)] + [(x, 25) for x in range(12, 17)]\nmake_place(\"hut\", HUT[0], HUT[1], 0)\nfor x, y in trail:\n    world.set_track(x, y)\nfor x, y in [(4, 26), (5, 27), (14, 21), (18, 22), (18, 27), (1, 27), (9, 27), (14, 27)]:\n    add_tree(x, y)\n"
          },
          {
            "id": "mission",
            "title": {
              "de": "Mission",
              "en": "Mission"
            },
            "level": "mission",
            "visibility": "hidden",
            "editable": false,
            "file": "mission.py",